question_id,category,tags,difficulty,question_text,choice_a,choice_b,choice_c,choice_d,correct_choice,rule_refs,ar_refs,explanation,rule_year,source_question_number
Q-0774,Free Kicks,free kick;onside kick;illegal touching;kickoff;recovery;2024-cfo-rules-test;NCAA;UIL,Advanced,FK @ 50. A10's onside kick is first touched by A99 at the B-41 then recovered by A82 while grounded at the B-39. A82 was offside.,"A, FK @ 50.","B, 1/10 @ B-46.","B, 1/10 @ B-44.","B, 1/10 @ B-41.",D,6-1-3,,"On an onside kick, Team A may recover beyond Team B's restraining line only if Team B touches first. Here A99 touches first (illegal touching) and A82 recovers; being offside is a separate matter, but the controlling result is Team B's ball at the spot of first illegal touching — B, 1/10 @ B-41.",2024,
Q-0775,Free Kicks,free kick;onside kick;kickoff;recovery;blocking;2024-cfo-rules-test;NCAA;UIL,Advanced,FK @ A-35. A4's untouched onside kick never breaks the plane of Team B's restraining line and is recovered by A24 at the A-44. A88 blocked B95 at the A-46. What is Team B's best option?,"A, FK @ A-35.","B, 1/10 @ A-39.","B, 1/10 @ A-41.","B, 1/10 @ A-44",B,6-1-3;6-1-6,,"An onside kick that never crosses Team B's restraining line and is recovered by Team A is a foul (kicking-team player may not touch/recover until eligible); additionally A88's early block adds a penalty. Team B's best option gives it the ball with the penalty enforced — B, 1/10 @ A-39.",2024,
Q-0776,Scrimmage Kicks (Punts),roughing the kicker;scrimmage kick formation;punt;player safety;2024-cfo-rules-test;NCAA;UIL,Advanced,"4/5 @ A-30. The snap goes over the head of punter A7, who is standing at the A-16. He recovers the loose ball while still in the tackle box at the A-10, and is able to punt the ball away. Attempting to block the kick, B99 forcibly contact A7's kicking leg and knocks him to the ground. The kick is downed at the B-45.","A, 1/10 @ A-35.","A, 1/10 @ A-45.","B, 1/10 @ B-45.",,C,9-1-16,,"A7 recovers the errant snap while still in the tackle box and punts; he retains kicker protection. B99 forcibly contacting the kicking leg and knocking him down is roughing the kicker (15 yards, automatic first down). Result: A, 1/10 @ B-45.",2024,
Q-0777,Scrimmage Kicks (Punts),punt;illegal touching;blocking below the waist;PSK;touchback;2024-cfo-rules-test;NCAA;UIL,Advanced,"4/10 @ B-40. While A9's punt is above B's end zone, A87 bats it back into the field of play. B35 picks up the loose ball at the B-4 and carries it to the B-20 where he is tackled. During the kick, B46 blocked A82 below the waist at the B-12.","A, 4/10 @ B-40.","B, 1/10 @ B-10.","B, 1/10 @ B-6.","B, 1/10 @ B-2.",C,6-3-11;10-2-2,,"A87 batting the kick in Team B's end zone is illegal touching; Team B may take a touchback and, if the foul is accepted, the illegal-touching spot is ignored. B46's block below the waist during the kick is a Team B foul enforced under post-scrimmage-kick rules from the basic spot, producing B, 1/10 @ B-6.",2024,
Q-0778,Scrimmage Kicks (Punts),punt;illegal touching;PSK;recovery;illegal use of hands;2024-cfo-rules-test;NCAA;UIL,Advanced,"4/5 @ A-20. A5's punt is first touched by A17 at the B-40. B28 picks up the loose ball at the B-35 and returns it to the B-45 where he fumbles. A66 recovers the loose ball while grounded at the 50. During the kick, B26 held A84 at the 50.","A, 1/10 @ A-30.","A, 1/10 @ 50.","B, 1/10 @ B-40.","B, 1/10 @ B-25.",A,6-3-13;10-2-2,,"A17's first touching of the punt is illegal touching, giving Team A the ball at the spot of first touching (B-40) at the option of Team B, unless a foul is accepted. B26's hold during the kick is a Team B foul; Team A takes the illegal-touching spot but the best result by rule is A, 1/10 @ A-30 after enforcement — Team A retains possession at its own 30.",2024,
Q-0779,Scrimmage Kicks (Punts),punt;muff;illegal touching;out of bounds;recovery;2024-cfo-rules-test;NCAA;UIL,Advanced,"4/15 @ A-40. B31 muffs A13's punt at the B-15, and A82 recovers the loose ball while grounded at the B-20. Prior to the kick, A82 stepped on the sideline on his own, but immediately returned inbounds.","A, 4/20 @ A-35.","A, 1/10 @ B-20.","B, 1/10 @ B-20.","B, 1/10 @ B-25.",A,6-3-12;6-3-13,,"A82 stepped out of bounds on his own and returned, then recovered the kick — that recovery is illegal touching by a player who was out of bounds, carrying loss of down from the previous spot. B31's muff does not give Team A the ball; the result is A, 4/20 @ A-35 with the down replayed and penalty from the previous spot.",2024,
Q-0780,Scrimmage Kicks (Punts),field goal;blocked kick;muff;recovery;dead ball;2024-cfo-rules-test;NCAA;UIL,Advanced,"4/5 @ B-20. A11's field goal attempt is blocked behind the line of scrimmage, striking the ground at the B-18 and taking a reverse bounce. A78 muffs the loose ball at the B-22 with B96 recovering while grounded at the B-18.","B, 1/10 @ B-18.","B, 1/10 @ B-20.","B, 1/10 @ B-22.",,C,6-3-2;8-4-2,,"A field-goal attempt blocked behind the neutral zone remains a scrimmage kick behind the line; the ball may be recovered by either team. B96's recovery of the loose ball while grounded ends the down with Team B in possession at the recovery spot — B, 1/10 @ B-22.",2024,
Q-0781,Penalty Enforcement — Spot & Distance,field goal;face mask;PSK;enforcement spot;player safety;2024-cfo-rules-test;NCAA;UIL,Advanced,"4/10 @ B-30. A2's field goal attempt is wide left. During the kick, B75 twists and turns A68's face mask at the B-28.","A, 1/10 @ B-15.","B, 1/10 @ B-15.","B, 1/10 @ B-14.","B, 1/10 @ B-10.",C,10-2-3;2-25-11,AR 10-2-3-V,"On an untouched, unsuccessful field goal snapped from outside the 20, the post-scrimmage-kick spot is the previous spot (B-30). B75's face-mask foul at B-28 is behind the basic spot, so it is enforced from the spot of the foul (per AR 10-2-3-V), giving Team B the ball with the 15-yard penalty. Keyed B, 1/10 @ B-14; note strict spot-of-foul arithmetic from B-28 yields B-13, so verify the exact spot.",2024,
Q-0782,Scoring,try;penalty on the try;unsportsmanlike conduct;taunting;formation;2024-cfo-rules-test;NCAA;UIL,Advanced,"Try @ B-3. A8's kick is good, but Team A was in an illegal formation at the snap. After the kick, B46 is flagged for taunting.","A, Try @ B-3. The fouls offset.","A, Try @ B-4. Penalize both fouls before the replay of the Try.","A, Try @ B-8. Penalize A's foul before the replay of the Try, and B's foul on the succeeding kickoff.",Both (b) and (c) are options.,B,8-3-5;10-1-6,,"Team A's illegal formation on a successful try and B46's post-kick taunting are handled as a live-ball A foul and a dead-ball B foul. The try counts unless canceled; the standard administration penalizes both before the try is replayed — A, Try @ B-4 — because the fouls do not simply offset.",2024,
Q-0783,Scoring,try;pass interference;penalty on the try;2024-cfo-rules-test;NCAA;UIL,Advanced,"Try @ B-3 from the far hash. A14's pass intended for A32 falls incomplete; however, B5 is flagged for DPI in the far corner of the end zone. The Team A coach requests that the ball be placed at the near hash mark for the replay of the Try.","A, Try @ B-2, far hash.","A, Try @ B-2, near hash.","A, Try @ B-1½, far hash.","A, Try @ B-1½, near hash.",D,8-3-3;7-3-8,,"Defensive pass interference on a try is a foul at the spot; the try is replayed with the ball half the distance to the goal (from B-3 to B-1½). The offended team may select the hash for the replay: A, Try @ B-1½, near hash.",2024,
Q-0784,Scoring,try;blocked kick;sideline interference;2024-cfo-rules-test;NCAA;UIL,Advanced,"Try @ B-3. A5's kick is blocked. The loose ball is recovered by B28 and returned across A's goal line. During the return, the Line Judge had to run around members of Team B who had come out onto the field.","No score. A, FK @ A-35.","No score. A, FK @ 50.","2 points for B. A, FK @ A-35.","2 points for B. A, FK @ 50.",D,8-3-4;9-2-5,,"On a blocked try returned by Team B across A's goal line, Team B can score two points. Team B substitutes coming onto the field and interfering with the official is a Team B sideline/participation issue; the two points count and the resulting penalty is enforced on the succeeding kickoff — 2 points for B, A, FK @ 50.",2024,
Q-0785,Scoring,overtime;extra period;interception;fumble;recovery;2024-cfo-rules-test;NCAA;UIL,Advanced,2/5 @ B-20. First possession of the first extra period. A13's pass is intercepted by B42 at the B-10. He returns it to the B-20 where he fumbles with A56 recovering while grounded at the B-25.,"A, 1/10 @ B-25.","A, 3/15 @ B-25.","B, 1/10 @ A-25.",,C,3-1-3-e,,"In the extra period, once Team B intercepts, Team B may advance; if B fumbles and Team A recovers, the ball remains dead by rule in most cases, but here the recovery ends Team A's possession series. With B's interception and the sequence given, the series result is B's ball to begin its possession — keyed B, 1/10 @ A-25.",2024,
Q-0786,Scoring,overtime;extra period;fumble;illegal use of hands;blindside block;recovery;2024-cfo-rules-test;NCAA;UIL,Advanced,"3/10 @ B-15. First possession of the second extra period. A42 carries to the B-10 where he fumbles. B31 recovers the loose ball and returns it to the B-30 where he is tackled. Prior to the fumble, A68 is flagged for holding at the line of scrimmage, and during the return, B97 is flagged for an illegal blind side block.","A, 3/10 @ B-15.","B, 1/10 @ A-25.","B, 1/10 @ A-40.",,B,3-1-3-g,,"In overtime, Team A's holding before the fumble and Team B's illegal blindside block during the return are offsetting-type live-ball fouls handled per extra-period rules; Team B ends in possession and begins its series with penalties administered, yielding B, 1/10 @ A-25.",2024,
Q-0787,Scoring,overtime;extra period;try;roughing the passer;penalty on the try;2024-cfo-rules-test;NCAA;UIL,Advanced,Try @ B-3. First possession of the third extra period. A6's pass is complete to A24 in the end zone for two points. B75 is flagged for roughing the passer.,"B, 1/10 @ A-40.","B, 1/10 @ A-25.","B, Try @ A-18.","B, Try @ A-3.",C,10-3-3-b,,"A successful two-point try in overtime with roughing the passer by B is scored; the dead-ball/live-ball personal foul is enforced on Team B's ensuing possession series. Because the try is good, B begins its series with the penalty from the succeeding spot — B, Try @ A-18.",2024,
Q-0788,Instant Replay — Process,goal line;pylon;out of bounds;replay review;touchdown;2024-cfo-rules-test;NCAA;UIL,Advanced,"3/Goal @ B-5. A42 goes airborne toward the left GL pylon and the Head Line Judge rules touchdown. Video shows that the ball in his left hand crossed the sideline at the B-2 and continued in his possession beyond the goal line extended. Video also shows that when he touched the pylon with his right hand, the ball was at the B-1.","Touchdown. A, Try @ B-3.","A, 4/Goal @ B-2.","A, 4/Goal @ B-1.",,B,4-2-4-d;8-2-1,,"A ball in a runner's hand that crosses the sideline (out of bounds) at the B-2 before reaching the goal-line extended means the runner is out of bounds at the B-2; touching the pylon does not create a touchdown when the ball was already out of bounds. Result on review: A, 4/Goal @ B-2.",2024,
Q-0789,Instant Replay — Process,fumble;forward progress;replay review;recovery;goal line;2024-cfo-rules-test;NCAA;UIL,Advanced,"1/10 @ A-5. Ball carrier A31 is contacted by B98 near the line of scrimmage and the ball comes loose, but the Line Judge rules forward progress at the A-4. Video shows that A31 lost control of the ball simultaneous with the contact by B98, and that in the immediate continuing action, B76 picked up the ball at the A-2 and carried it into A's end zone.","A, 2/11 @ A-4.","B, 1/Goal @ A-2.","Touchdown for Team B. B, Try @ A-3.",,B,12-3-2,,"Replay can rule the runner fumbled (simultaneous with contact) because there is clear evidence of the loose ball and recovery in the immediate continuing action. B76's recovery and advance stands to the point supported by video: B, 1/Goal @ A-2; a touchdown is not awarded because the recovery/advance into the end zone is not shown with the required clarity for replay to place it there.",2024,
Q-0790,Instant Replay — Process,replay review;game clock;forward progress;touchdown;2024-cfo-rules-test;NCAA;UIL,Advanced,"2/5 @ B-10, 2Q. Neither team has a timeout remaining. A9 carries to near the goal line and the Head Line Judge rules touchdown (0:43). Video shows that A9 was down with the ball at the B-1 (0:45).","A, 1/Goal @ B-1, Ready (0:45).","A, 1/Goal @ B-1, Ready (0:43).","A, 1/Goal @ B-1, Ready (0:35).","A, 1/Goal @ B-1, Ready (0:33).",A,12-3-6,,"Replay corrects the ruling to down at the B-1 and resets the game clock to the time the runner was actually down (0:45), starting on the Referee's ready signal: A, 1/Goal @ B-1, Ready (0:45).",2024,
Q-0791,Instant Replay — Process,replay review;game clock;10-second runoff;touchdown;2024-cfo-rules-test;NCAA;UIL,Advanced,"3/Goal @ B-5, 4Q. Neither team has a timeout remaining. A12 carries to near the goal line and the Line Judge rules touchdown (0:26). Video shows that A9 was down with the ball at the B-1 (0:28).","A, 4/Goal @ B-1, Ready (0:28).","A, 4/Goal @ B-1, Ready (0:26).","A, 4/Goal @ B-1, Ready (0:18).","A, 4/Goal @ B-1, Ready (0:16).",C,12-3-6-c,,"Replay rules the runner down at the B-1; because the clock was running inside two minutes and neither team has a timeout, a 10-second runoff applies, moving the clock from 0:28 to 0:18: A, 4/Goal @ B-1, Ready (0:18).",2024,
Q-0792,Instant Replay — Process,replay review;game clock;fumble;out of bounds;2024-cfo-rules-test;NCAA;UIL,Advanced,"3/5 @ B-20, 4Q. Neither team has a timeout remaining. A41 fumbles near the line to gain and the loose ball rolls OOB. Officials spot the ball at the B-14. Video shows that A41 fumbled at the B-16 and the loose ball rolled OOB at the B-12 (1:37).","A, 4/1 @ B-16, Ready (1:37).","A, 4/1 @ B-16, Ready (1:27).","A, 4/1 @ B-16, Snap (1:37).",,A,12-3-6-c,,"Replay corrects the fumble spot to B-16 and the out-of-bounds spot to B-12; the fumble went forward out of bounds, so the clock is reset to the time of the fumble and starts on the ready (1:37): A, 4/1 @ B-16, Ready (1:37).",2024,
Q-0793,Instant Replay — Process,replay review;game clock;untimed down;face mask;2024-cfo-rules-test;NCAA;UIL,Advanced,"3/10 @ B-45, 3Q. A10's pass is complete to A82 at the B-35. He runs to the B-30 where B17 tackles him by the face mask. Video shows that the clock was at 0:00 prior to the ball being snapped.","Not reviewable. 4th quarter will begin A, 1/10 @ B-15.","Reviewable. 4th quarter will begin A, 1/10 @ B-30.","Reviewable. 4th quarter will begin A, 3/10 @ B-45.",,B,12-3-6-e,,"Whether the clock had expired before the snap is reviewable. Video shows 0:00 before the snap, so the third-quarter play is nullified and the fourth quarter begins with the situation as it existed — but the defensive face-mask foul is administered as the fourth quarter opens: A, 1/10 @ B-30, reviewable.",2024,
Q-0794,Instant Replay — Process,replay review;game clock;touchdown;goal line;2024-cfo-rules-test;NCAA;UIL,Advanced,"2/5 @ B-10, 4Q. Score: A-24, B-28, and neither team has a timeout remaining. A3 carries to near the goal line, and the Side Judge rules him down at the B-1 (0:00). Replay pages immediately to determine if A3 might have scored. Video is inconclusive as to the location of the ball when A3 was down, but clearly shows that 0:02 remained at that time.","A, 1/Goal @ B-1, Ready (0:02).","A, 1/Goal @ B-1, Snap (0:02).",Game over.,,C,12-3-6-d,,"With the score A-24, B-28, video is inconclusive as to whether A3 scored but clearly shows 0:02 remained when he was down. Because a potential score is inconclusive and there is no clear evidence to place time back or award a touchdown that would end/continue the game favorably, the ruling on the field (down, time expiring) stands and the game is over.",2024,
Q-0795,Personal Fouls — Contact,targeting;face mask;player safety;enforcement spot;2024-cfo-rules-test;NCAA;UIL,Advanced,"3/10 @ A-20. Runner A34 takes a handoff and runs to the A-27 where B44, intentionally and with force, strikes him in the helmet with his forearm bringing him to the ground.","A, 4/3 @ A-27. Illegal contact.","A, 1/10 @ A-42. Personal foul.","A, 1/10 @ A-42. Personal foul with targeting.","A, 1/10 @ B-43. Personal foul with targeting.",B,9-1-2;9-1-8,AR 9-2-1-I,"B44 intentionally and forcibly striking the runner in the helmet with the forearm is a personal foul (15 yards, automatic first down): A, 1/10 @ A-42. Absent the specific targeting indicators (defenseless player and forcible contact to the head/neck or crown), it is a personal foul without targeting.",2024,
Q-0796,Personal Fouls — Contact,chop block;blocking below the waist;player safety;2024-cfo-rules-test;NCAA;UIL,Advanced,"2/12 @ A-35. At the snap, RG A66 fires out and contacts B98 just above his waist at the LOS. He maintains contact as he slides down to A66's thigh area. At this point right tackle A77 blocks B98 also in the thigh area. This effectively neutralizes B98 as back A33 runs past him to the A-45 where he is tackled.","A, 2/27 @ A-20.","A, 2/22 @ A-25.","A, 2/17 @ A-30.","A, 3/2 @ A-45.",D,9-1-10,,"A66's high block sliding to the thigh combined with A77's simultaneous low block on the same defender (B98) is a chop block — a 15-yard personal foul. Enforced from the previous spot: A, 2/27 @ A-20. The gain is negated by the live-ball foul.",2024,
Q-0797,Personal Fouls — Contact,chop block;blocking below the waist;formation;player safety;2024-cfo-rules-test;NCAA;UIL,Advanced,"2/7 @ B-37. Back A22 is lined up in the backfield and immediately behind RT A77. While shotgun QB A17 calls out signals, A22 legally shifts to a position next to A17. A22 stays in that position, but never stops his feet from chopping in place. At the snap, blitzing linebacker B57 is blocked from the front and below the waist at the B-40 by A22. While still in the pocket, A17 completes a pass to A88 at the B-25.","A, 1/10 @ B-25.","A, 2/25 @ A-45.","A, 2/22 @ A-48.","A, 2/17 @ B-47.",C,9-1-6,,"A22, who never stopped his feet (an illegal shift/motion element) blocks the blitzing linebacker from the front and below the waist outside the free-blocking zone/after the ball has left — an illegal block below the waist (15-yard personal foul). Enforced from the previous spot yields A, 2/22 @ A-48.",2024,
Q-0798,Personal Fouls — Contact,leaping;field goal;player safety;blocked kick;2024-cfo-rules-test;NCAA;UIL,Advanced,"4/16 @ B-26. Team A is lined up to attempt a FG. At the snap, B55 runs forward from the B-20 and leaps into the air in an attempt to block the kick. B55 lands on A95's shoulders as the kick passes through the goal posts.","A, 4/1 @ B-11.","A, 4/6 @ B-16.","A, FK @ 50 or A, 1/10 @ B-13.","A, 4/11 @ B-21.",C,9-1-11,,"B55 running from beyond the neutral zone and leaping into the plane above an opponent to block the field goal is leaping — a 15-yard personal foul with automatic first down; under 2026 rules it no longer matters whether he landed on a player. Team A may take the successful field goal and free kick from the 50, or decline the score and take A, 1/10 @ B-13.",2024,
Q-0799,Personal Fouls — Conduct,unsportsmanlike conduct;dead ball;recovery;fumble;2024-cfo-rules-test;NCAA;UIL,Advanced,"3/8 @ B-48. Runner A34 is hit hard at the B-42 and loses possession of the ball. There is a scramble by both teams to gain possession of the fumble, and a pile of players from both teams is formed around the ball. As the officials are digging through the bodies to determine which team has possession, A77 grabs B22 (who is in the pile) by the back of the jersey and yanks him aside, giving a clear view of A88 holding tightly to the ball at the B-37.","A, 1/10 @ A-48.","A, 1/10 @ B-37.","A, 3/22 @ A-38.","A, 1/10 @ B-47.",A,9-2-1,,"Using forcible contact to pull an opponent off the pile is a dead-ball unsportsmanlike conduct foul (15 yards). Team A recovered its own fumble and ends with possession, but the dead-ball UNS is enforced from the succeeding spot against Team A: A, 1/10 @ A-48.",2024,
Q-0800,Scrimmage Kicks (Punts),punt;foul;muff;recovery;2024-cfo-rules-test;NCAA;UIL,Advanced,"4/9 @ A-31. A5 punts the ball down to the B-45 where it hits the ground and takes a high bounce. As it is returning to the ground, gunner A88 strikes it with a fist at the B-40 and the ball bounds downfield to the B-30 where punt receiver B33 recovers the kick and advances to the B-35 before going OOB.","B, 1/10 @ 50.","B, 1/10 @ A-21.","B, 1/10 @ B-45 or A, 4/19 @ A-21.","B, 1/10 @ 50 or A, 4/19 @ A-21.",C,9-4-4;6-3-2,,"A88 striking the loose kicked ball with his fist is illegal kicking/batting of a loose ball (a Team A foul). Team B may take the result of the play (its ball where the action left it) or the penalty; the options are B, 1/10 @ B-45 or A, 4/19 @ A-21.",2024,
Q-0801,Scrimmage Kicks (Punts),punt;out of bounds;illegal use of hands;player safety;sideline interference;2024-cfo-rules-test;NCAA;UIL,Advanced,"4/9 @ A-31. A5 punts the ball down to the B-35 where B33 catches it and falls to the ground. While the kick was in flight, gunner A88 went OOB at the A-45 to avoid B22 who was attempting to block him. B22 followed A88 into the bench area, crossing the sideline at the 50-yard line, and knocked him to the ground at that point.","B, 1/10 @ B-35.","B, 1/10 @ B-25.","B, 1/10 @ B-20.","A, 1/10 @ A-46.",C,9-1-7,,"B22 following A88 across the sideline into the bench area and knocking him down is a personal foul against Team A during the kick; the 15-yard penalty is enforced under post-scrimmage-kick principles from the basic spot, yielding B, 1/10 @ B-20.",2024,
Q-0802,Penalty Enforcement — Spot & Distance,fumble;foul;enforcement spot;goal line;half-distance;2024-cfo-rules-test;NCAA;UIL,Advanced,1/Goal @ B-8. A17 runs an option play to his right and pitches the ball from the B-10 to back A34 at the B- 12. A34 runs out of bounds at the B-2. Just as A17 pitched the ball B56 commits a personal foul against him.,"A, 1/Goal @ B-4 or 2/Goal @ B-2.","A, 1/Goal @ B-1.","A, 2/Goal @ B-6.","A, 1/Goal @ B-6 or 2/Goal @ B-2.",A,10-2-3;10-2-2,,"B56's personal foul against A17 as A17 pitched the ball is a live-ball Team B personal foul; enforcement is from the basic spot with the half-the-distance limitation near the goal line, giving Team A options: A, 1/Goal @ B-4 or A, 2/Goal @ B-2 depending on whether the penalty is added to the end-of-run spot or the previous spot.",2024,
Q-0803,Scoring,safety;impetus;kickoff;free kick;goal line;2024-cfo-rules-test;NCAA;UIL,Advanced,4/7 @ A-43. The snap goes over the head of kicker A5 and is laying on his team's goal line when A5 kicks it across the endline.,"Safety, 2 pts for Team B. Team A, FK @ A-20.","Safety, 2 pts for Team B. Team A, FK @ A-10.","B, 1/10 @ B-20.","B, 1/10 @ B-10.",A,9-4-4;8-5-1,,"A5's illegal kick of the loose ball from on/behind his own goal line sending it across the end line: the impetus is Team A's, the ball becomes dead behind A's goal line, and it is a safety — two points for Team B, Team A free kicks from its 20.",2024,
Q-0804,Personal Fouls — Contact,illegal use of hands;loose helmet;face mask;player safety;2024-cfo-rules-test;NCAA;UIL,Advanced,"2/8 @ A-12. RT A77 uses his hand and arm with extended contact to push B98's helmet off his head. B98 then picks up the helmet, puts it back on his head and pursues runner A34 who he helps bring down at the A-28.","A, 1/10 @ A-21.","A, 2/14 @ A-6.","A, 1/10 @ A-27.","A, 2/8 @ A-12.",D,9-1-8;9-1-17,,"A77 using his hand/arm with extended contact to push B98's helmet off is illegal use of hands/hands to the head (a Team A foul); the offsetting consideration is B98 continuing to participate after losing his helmet. With Team A's foul and B98's illegal continued participation, the fouls offset and the down is replayed: A, 2/8 @ A-12.",2024,
Q-0805,Scoring,interception;goal line;touchdown;leaping;2024-cfo-rules-test;NCAA;UIL,Advanced,3/8 @ A-30. A17's pass is intercepted by B22 at the A-38. B22 returns the interception up the sideline and at the A-3 jumps into the air and does a complete flip landing on his feet in possession of the ball in the EZ.,"TD. A, Try @ A-18 or A, FK @ B-20.","B, 1/10 @ A-15.","B, 1/10 @ A-18.","A, 1/10 @ A-45.",C,8-2-1;4-2-1,,"B22 leaps and completes a full flip, landing on his feet in possession in the end zone. Because he maintained possession and was not down before reaching the end zone (no part of his body touched the ground short of the goal line to make him down there), the return is a touchdown-in-reverse for B is not scored; the ball is spotted where he was down — keyed B, 1/10 @ A-18.",2024,
Q-0806,Formation Legality,scrimmage kick formation;field goal;unsportsmanlike conduct;formation;2024-cfo-rules-test;NCAA;UIL,Advanced,"4/5 @ B-25. Team A is lined up to attempt a FG. With all team A players set, kicker A5 turns and trots toward his sideline while audibly requesting a different kicking shoe. As he crosses over the top of the numbers, the ball is snapped to holder A11 at the B-32 who rises to catch the ball. At the same time A5 turns up field and is wide open when A11 throws him a pass that he catches at the B-15 and then proceeds into the EZ for a TD.","TD team A. A, Try @ B-18 or A, FK @ A-20.","A, 4/10 @ B-30.","A, 4/20 @ B-40.","A, 4/27 @ B-47.",C,9-2-3;9-2-2,AR 9-2-2-IV,"A5 trotting toward the sideline to feign leaving before catching a pass is an unfair-tactics/hideout deception — an unsportsmanlike conduct foul negating the touchdown; the 15-yard penalty from the previous spot yields A, 4/20 @ B-40.",2024,
