question_id,category,tags,difficulty,question_text,choice_a,choice_b,choice_c,choice_d,correct_choice,rule_refs,ar_refs,explanation,rule_year
Q-0049,Personal Fouls — Contact,blocking below the waist;momentum,Advanced,"2/5 @ B-30. A6's pass is intercepted by B19 at the B-4, and his momentum carries him into B's EZ. From there, he fumbles and the loose ball rolls OOB at the B-2. After the interception, B17 blocked A86 in the back at the B-6.",Safety. Two points for A.,"B, 1/10 @ B-1.","B, 1/10 @ B-2.","B, 1/10 @ B-3.",C,9-3-5; 2-25-8-b; 7-2-4-b-1; 8-5-1-a-Exception (c); 10-2-2-d-2-b-Exception; 10-2-2-c-2,AR 7-2-4 I (b),"The correct ruling is: B, 1/10 @ B-2. (Rule 9-3-5).",2026
Q-0050,Personal Fouls — Contact,targeting;disqualification,Advanced,1/10 @ B-20. A5's pass is complete to A84 at the B-15. He runs to the B-6 where he is hit by B29 and fumbles. The loose ball is recovered by B34 while grounded in B's EZ. Video shows that B29 lowered his head and attacked A94 with forcible contact using the crown of his helmet. 3.3.2.b.1,"A, 1/Goal @ B-10, Ready. DQ B29.","A, 1/Goal @ B-10, Snap. DQ B29.","A, 1/Goal @ B-3, Ready. DQ B29.","A, 1/Goal @ B-3, Snap. DQ B29.",D,12-3-5-a-1; 12-3-5-b; 2-25-8-b; 10-2-2-d-1-b; 10-2-2-c-3; 3-3-2-d-1,,"The correct ruling is: A, 1/Goal @ B-3, Snap. DQ B29. (Rule 12-3-5-a-1).",2026
Q-0051,Instant Replay — Process,replay review,Advanced,"4/5 @ B-30, 2Q. A1 runs to near the line to gain where he fumbles with A84 recovering while grounded at the B-22 (0:57). The ruling on the field is that the fumble occurred at the B-24, and officials award a new series to Team A there. Video shows that A1 fumbled at the B-26 (0:59). RR: 7.2.2.A EX:2 4.1.3.J","B, 1/10 @ B-26, Snap (0:59).","B, 1/10 @ B-26, Snap (0:57).","B, 1/10 @ B-22, Snap (0:59).","B, 1/10 @ B-22, Snap (0:57).",B,12-3-3-f; 7-2-2-a-Exception; 4-1-3-j; 12-3-6-b,,"The correct ruling is: B, 1/10 @ B-26, Snap (0:57). (Rule 12-3-3-f).",2026
Q-0052,Instant Replay — Process,replay review,Advanced,"3/10 @ B-40, 4Q. Neither team has a timeout remaining. A5 carries to the B-31 where the ruling on the field is a fumble, recovered near the sideline by B94 (0:46). Video shows that A5 was down at the B-31 (0:48) prior to losing control of the ball.","A, 4/1 @ B-31, Ready (0:48).","A, 4/1 @ B-31, Ready (0:46).","A, 4/1 @ B-31, Ready (0:38).","A, 4/1 @ B-31, Ready (0:36).",C,12-3-6-c,,"The correct ruling is: A, 4/1 @ B-31, Ready (0:38). (Rule 12-3-6-c).",2026
Q-0053,Instant Replay — Process,replay review,Advanced,"3/10 @ B-40, 4Q. Neither team has a timeout remaining. A5 carries to the B-31 where the ruling on the field is a fumble, recovered near the sideline by B94. Video confirms the fumble (0:48), but shows that B94 was OOB when he first touched the loose ball (0:46). 12.3.6.b","A, 4/1 @ B-31, Ready (0:48).","A, 4/1 @ B-31, Ready (0:46).","A, 4/1 @ B-31, Ready (0:38).","A, 4/1 @ B-31, Ready (0:36).",B,12-3-6-b,,"The correct ruling is: A, 4/1 @ B-31, Ready (0:46). (Rule 12-3-6-b).",2026
Q-0054,Instant Replay — Process,replay review,Advanced,"1/10 @ A-25, 3Q. A2's pass is complete to the A11 at the A-40. He carries to the B-45 where he runs OOB and B26 is flagged for a late hit. Video shows that the clock hit 0:00 before the snap. When the 4th quarter begins, it will be: RR: 12.3.6.e","A, 1/10 @ B-30.","A, 1/10 @ B-45.","A, 1/10 @ A-40.","A, 1/10 @ A-25.",C,12-3-6-e; 12-3-6-j,,"The correct ruling is: A, 1/10 @ A-40. (Rule 12-3-6-e).",2026
Q-0055,Instant Replay — Process,replay review,Advanced,"3/5 @ B-20, 4Q. Score: A-24, B-28. Neither team has a timeout remaining. A7's pass is complete to A41 where the ruling on the field is a touchdown (0:00). Video shows that A41 completed the catch, but was down at the B-1 (0:02). B96 was lined up in the neutral zone at the snap.","A, 1/Goal @ B-1, Ready (0:02).","A, 1/Goal @ B-1, Snap (0:02).","A, 1/10 @ B-15, Untimed down.",No touchdown. Game over.,B,3-4-3-b; 12-3-6-d-2; 12-3-6-d-3,,"The correct ruling is: A, 1/Goal @ B-1, Snap (0:02). (Rule 3-4-3-b).",2026
Q-0056,Free Kicks,free kick;touchback;safety,Intermediate,FK @ A-35. The kick first hits the ground at the B-10 and is rolling towards Team B’s goal line. B33 has a knee down in the end zone when he successfully recovers the kick. Which of the following is not true:,It is a touchback if the ball is completely behind the goal line when B33 successfully recovers.,It is a touchback if half the ball is in the field of play when B33 successfully recovers.,It is a safety if B33 first muffs the ball before it reaches the goal line but then successfully recovers the kick with a knee down while the ball is completely in the end zone.,The succeeding spot is where the ball becomes dead in the field of play if B33 successfully recovers before the ball reaches the goal line.,C,8-5-1-a; 8-6-1-a; 8-6-1-b,,The correct ruling is: It is a safety if B33 first muffs the ball before it reaches the goal line but then successfully recovers the kick with a knee down while the ball is completely in the end zone. (Rule 8-5-1-a).,2026
Q-0057,Free Kicks,free kick,Intermediate,"FK @ A-35. While A7's kick is in the air, B64 and B78 form a wedge at the B-20. B89 fields the kick at the B- 10 and returns it to the B-30 where he is tackled.","A, Free Kick @ 50.","B, 1/10 @ B-5.","B, 1/10 @ B-10.","B, 1/10 @ B-15.",C,6-1-10-b; 6-1-10-b-Penalty,,"The correct ruling is: B, 1/10 @ B-10. (Rule 6-1-10-b).",2026
Q-0058,Formation Legality,formation;covered receiver,Intermediate,"1/10 @ B-15. In a formation where A8 intends to be a lineman but not at the end of the line (intentionally covered up), which of the following must be true?",A8’s head must break the waist of the snapper.,A8’s head must break the waist of the nearest interior lineman.,A8’s head must break the backside of the nearest interior lineman.,A8’s head must break the waist of the outside receiver on the line of scrimmage.,A,2-27-4-a-2,,The correct ruling is: A8’s head must break the waist of the snapper. (Rule 2-27-4-a-2).,2026
Q-0059,Formation Legality,formation;covered receiver,Intermediate,"1/10 @ B-30. After a long gain, A16 is trying to get set as a wide receiver. Before A16 gets set at the same time as his ten teammates, the ball is snapped. A16 was never in a set position. QB A11 is tackled for a loss at the B-35.",Live ball foul for an Illegal Shift.,"Team B can decline the penalty to bring up A, 2/15@ B-35.",Dead ball foul for a False Start.,Both (a) and (b).,C,7-1-2-b-5,,The correct ruling is: Dead ball foul for a False Start. (Rule 7-1-2-b-5).,2026
Q-0060,Backward Pass & Fumbles,muff;fumble;out of bounds,Intermediate,"4/3 @ B-12. After the Two-Minute Timeout, A19 pitches the ball from the B-13 back to A31, but A31 muffs the ball at the B-15. The ball bounces forward OOB at the B-8.","B, 1/10 @ B-13, Snap.","B, 1/10 @ B-15, Snap.","A, 1/Goal @ B-8, Ready.","A, 1/Goal @ B-8, Snap.",D,2-11-2; 7-2-4-a; 3-3-2-d-2,,"The correct ruling is: A, 1/Goal @ B-8, Snap. (Rule 2-11-2).",2026
Q-0061,Forward Pass,illegal touching;covered receiver,Advanced,"1/10 @ A-40. Receiver A80 lines up on the line of scrimmage, covered up by outside receiver A10. After the snap, A80 retreats into the backfield to catch an apparent backwards pass. A16 throws a pass from the A-34. A80 catches the pass at the A-35 and runs out of bounds at the A-45.","Illegal Touching of a Forward Pass. A, 1/15 @ A-35.","Intentional Grounding. A, 2/16 @ A-34.","Illegal Touching of a Forward Pass. A, 2/15 @ A-35.","Illegal Touching of a Forward Pass. A, 2/16 @ A-34.",C,7-3-3-c-1; 7-3-11; 7-3-11-Penalty,,"The correct ruling is: Illegal Touching of a Forward Pass. A, 2/15 @ A-35. (Rule 7-3-3-c-1).",2026
Q-0062,Formation Legality,illegal formation;10-second runoff,Advanced,"1/10 @ B-20, 4Q. With Team A behind in the score, Team A quickly lines up and legally snaps the ball to A12 who then throws the ball directly into the ground from the B-28 (0:09). Team A’s formation was illegal at the snap.",Game Over. 10-second runoff is option due to the Illegal Formation foul.,"A, 1/15 @ B-25, Snap.","A, 2/18 @ B-28, Snap.","A, 2/23 @ B-33, Ready.",B,3-4-4-b; 7-1-4-a-Penalty,,"The correct ruling is: A, 1/15 @ B-25, Snap. (Rule 3-4-4-b).",2026
Q-0063,Personal Fouls — Contact,illegal use of hands,Intermediate,2/15 @ A-25. A16 takes that snap and rolls to his right. Linebacker B55 is at the A-32 and sees A88 on a shallow crossing route at the A-28 when B55 moves forward and pushes A88 in the back and to the ground. A16 keeps the ball and runs OOB at the A-27. 9.3.4.e,"No foul since A88 had not yet occupied the same yard line as B55. A, 3/13 @ A-27.","Foul for Illegal Use of Hands. A, 1/10 @ A-35.","Foul for Illegal Use of Hands. A, 1/10 @ A-37.","Foul for Illegal Use of Hands. A, 2/3 @ A-37.",C,9-3-4-e; 9-3-4-e-Penalty; 2-25-8-a; 10-2-2-d-1-b; 10-2-2-c-3,,"The correct ruling is: Foul for Illegal Use of Hands. A, 1/10 @ A-37. (Rule 9-3-4-e).",2026
Q-0064,Personal Fouls — Contact,illegal use of hands,Intermediate,"3/15 @ B-45. Team A attempts a screen pass to A89, who is held at the B-49. QB A7 runs the B-42 where he is tackled.","A, 3/5 @ B-35.","A, 3/2 @ B-32.","A, 1/10 @ B-35.","A, 1/10 @ B-32.",D,9-3-4-e; 9-3-4-e-Penalty; 2-25-8-a; 10-2-2-d-1-b; 10-2-2-c-3,,"The correct ruling is: A, 1/10 @ B-32. (Rule 9-3-4-e).",2026
Q-0065,Forward Pass,intentional grounding,Intermediate,"3/5 @ B-35. Team A has no timeouts remaining. After the Two-Minute Timeout, QB A12, who has not been outside the tackle box, throws a pass under pressure from the B-42. RT A77 touches the ball in an attempt to catch it. The pass falls incomplete (0:54). There were no eligible receivers anywhere near the area of the pass. 7.3.2","A, 4/10 @ B-40, Snap.","A, 4/10 @ B-40, the penalty includes an option for a 10-second runoff.","A, 4/12 @ B-42, the penalty includes an option for a 10-second runoff.","A, 4/12 @ B-42, Snap.",C,7-3-2-h; 7-3-2-h-Penalty; 3-4-4-a-3,,"The correct ruling is: A, 4/12 @ B-42, the penalty includes an option for a 10-second runoff. (Rule 7-3-2-h).",2026
Q-0066,Forward Pass,intentional grounding,Intermediate,"3/5 @ A-35. A16 muffs the shotgun snap, and it is recovered by A32 behind the line of scrimmage. A32 scrambles with the ball and three yards from the sideline, he throws a forward pass from the A-26 that crosses the neutral zone and lands OOB. A66 was at the A-41 when the forward pass was thrown.","A, 4/14 @ A-26.","A, 3/10 @ A-30.","A, 4/5 @ A-35.","A, 4/19 @ A-21.",C,7-3-2-h-Exception; 7-3-10-Exception,,"The correct ruling is: A, 4/5 @ A-35. (Rule 7-3-2-h-Exception).",2026
Q-0067,Periods & Time Factors,game clock;free kick,Advanced,"3/6 @ B-44, 4Q. Score: A-21, B-21. Team A is out of timeouts. A16 scrambles as he is trying to find an open receiver downfield. He finally throws from the B-43 to A81. A81 completes the catch and is tackled in bounds at the B-19 (0:31).","A, 4/11 @ B-49, no 10-second runoff, Team B has the option for clock status.","A, 4/11 @ B-49, the penalty includes an option for a 10-second runoff.","A, 4/10 @ B-48, no 10-second runoff, Team B has the option for clock status.","A, 4/10 @ B-48, the penalty includes an option for a 10-second runoff.",C,7-3-2-a; 7-3-2-a-Penalty; 3-4-4-b; 3-4-3-b,,"The correct ruling is: A, 4/10 @ B-48, no 10-second runoff, Team B has the option for clock status. (Rule 7-3-2-a).",2026
Q-0068,Periods & Time Factors,game clock;free kick,Advanced,"FK @ A-35. Receiver B80 catches the kick in the end zone. As he begins his return, he fumbles from the end zone, and the ball rolls OOB at the B-8. 3.3.2.a","B, 1/10 @ B-8. The game clock does not start during the down.","B, 1/10 @ B-8. The game clock starts when the loose ball enters the field of play.","B, 1/10 @ B-25. The game clock does not start during the down.","B, 1/10 @ B-25. The game clock starts when the loose ball enters the field of play.",D,3-3-2-a,,"The correct ruling is: B, 1/10 @ B-25. The game clock starts when the loose ball enters the field of play. (Rule 3-3-2-a).",2026
