question_id,category,tags,difficulty,question_text,choice_a,choice_b,choice_c,choice_d,correct_choice,rule_refs,ar_refs,explanation,rule_year,source_question_number
Q-0312,Instant Replay — Process,instant replay;muffed punt;postscrimmage kick;2024-cfo-preseason-quiz;2024-cfo-preseason-quiz-v2;NCAA;UIL,Advanced,4/10 @ A-25. Returner B3 signals for a fair catch (valid) but muffs A1's punt at the B-30 and the ball is immediately recovered by A5 on the ground at the B-27. The Back Judge ruled that B3 caught the ball and killed the play blowing the whistle. The Side Judge had a flag down for holding by B14 during the kick.,"B, 1/10, B-30, Snap.","A, 1/10, B-27, Ready.","A, 1/10, B-27, Snap.","A, 1/17, B-27, Snap.",C,,,"The correct ruling is: A, 1/10, B-27, Snap. Whether the ball was possessed or muffed is reviewable, and since there is a clear recovery in the continuing action, replay gives Team A possession at that spot. Team A will decline the holding penalty. If there was no clear recovery, the ruling on the field would stand and the penalty would use postscrimmage kick enforcement.",2024,9
Q-0313,Instant Replay — Process,instant replay;pass interference;line of scrimmage;2024-cfo-preseason-quiz;2024-cfo-preseason-quiz-v2;NCAA;UIL,Advanced,3/10 @ B-40. A1's pass is caught at the B-41 by A3 who runs to the B-5 where he is tackled in bounds. The Side Judge has a flag down and reports to the Referee offensive pass interference by A14 for blocking downfield before the ball was caught.,"A, 1/20, B-25, Ready.","A, 1/Goal, B-5, Snap.","A, 1/Goal, B-6, Ready.","A, 1/Goal, B-5, Ready.",D,,,"The correct ruling is: A, 1/Goal, B-5, Ready. Where the ball was touched in relation to the line of scrimmage is reviewable. Replay informs the Referee via O2O that the ball was first touched behind the line of scrimmage, so there is no foul for offensive pass interference.",2024,10
Q-0314,Substitutions,substitution mechanics;out of bounds;2024-cfo-preseason-quiz;2024-cfo-preseason-quiz-v3;NCAA;UIL,Intermediate,"1/10 @ A-25. Late in the 1st quarter, ball carrier A21 circles right end toward his team area and is hit by B54 at the A-30. A21 continues to drive forward and lands with his body down at the A-34 out of bounds in the white. There are no substitutions for Team A.","A, 2/1, A-34, Ready.","A, 2/1, A-34, Snap.","A, 2/6, A-30, Ready.","A, 2/1, A-34, Running.",A,,AR 3-5-2 IX,"The correct ruling is: A, 2/1, A-34, Ready. The game clock is stopped and restarts on the Referee's signal. The play clock is set to 40. When Team A players go out of bounds after the play between the twenty-yard lines on their team area's side of the field, the Referee will initiate the ""T"" and work through substitution mechanics.",2024,1
Q-0315,Personal Fouls — Conduct,dead ball foul;personal foul;two-minute timeout;2024-cfo-preseason-quiz;2024-cfo-preseason-quiz-v3;NCAA;UIL,Advanced,"3/4 @ B-30. Following the Two-Minute Timeout in the 4th quarter, ball carrier A22 runs and goes out of bounds at the B-18. B88 commits a dead ball personal foul immediately after the ball is out of bounds.","A, 1/Goal, B-9, Ready.","A, 1/Goal, B-9, Snap.","A, 2/9, B-18, Snap.","A, 1/Goal, B-3, Snap.",B,5-2-7-a; 3-3-2-d-2,,"The correct ruling is: A, 1/Goal, B-9, Snap. The penalty for any dead ball foul that occurs after a series ends and before the ball is ready for play shall be completed before the line to gain is established. When the ball carrier is out of bounds, the clock starts on the snap any time after the Two-Minute Timeout in either half.",2024,2
Q-0316,Free Kicks,free kick;onside kick;ball relocation;2024-cfo-preseason-quiz;2024-cfo-preseason-quiz-v3;NCAA;UIL,Advanced,"Free Kick @ A-35. Late in the game with the score tied, Team A lines up to free kick and Kicker A10 places the ball down at the right hash for an apparent onside kick. After the Referee's ready-for-play signal, A10 approaches the ball and then picks up the ball, runs to the left hash at the A-35, places the ball down, and quickly kicks the ball.","A, Free Kick, A-35, Free Kick Rules.","A, Free Kick, A-30, Snap.","A, Free Kick, A-30, Free Kick Rules.","B, Free Kick, B-30, Free Kick Rules.",C,,AR 6-1-2 VIII,"The correct ruling is: A, Free Kick, A-30, Free Kick Rules. By interpretation, once the ball position between the hash marks has been selected by Team A and after the ready-for-play, the ball may be relocated only after a charged team timeout or before any re-kick. This action results in a dead-ball foul, a 5-yard penalty from the succeeding spot.",2024,3
Q-0317,Formation Legality,false start;neutral zone;formation;2024-cfo-preseason-quiz;2024-cfo-preseason-quiz-v3;NCAA;UIL,Advanced,"1/10 @ A-25. With the game clock running, defender B70 is lined up with his right hand and helmet in the neutral zone. As the play clock winds down, restricted lineman A77 reaches out and touches B70.","B, 1/5, A-30, Ready.","A, 1/15, A-20, Snap.","A, 1/10, A-25, Ready.","A, 1/15, A-20, Ready.",D,7-1-2-b-3,AR 7-1-2 VI,"The correct ruling is: A, 1/15, A-20, Ready. Dead ball foul, false start by A77. With the defense lined up in the neutral zone and no immediate reaction by the offense, the offense subsequently moving to touch or contact the defender is a false start on the offense.",2024,4
Q-0318,Forward Pass,intentional grounding;10-second runoff;two-minute timeout;2024-cfo-preseason-quiz;2024-cfo-preseason-quiz-v3;NCAA;UIL,Advanced,"2/10 @ B-30. After the Two-Minute Timeout in the second quarter, the ball is snapped over the head of quarterback A12, who is in the shotgun formation. A12 recovers the ball and immediately throws it forward into the ground to conserve time at the B-40. The clock reads 1:01 after the play.","A, 3/20, B-40, 10-Second Subtraction.","A, 3/20, B-40, Ready.","A, 2/20, B-40, 10-Second Subtraction.","A, 3/10, B-30, 10-Second Subtraction.",A,7-3-2-f; 3-4-4-a,,"The correct ruling is: A, 3/20, B-40, 10-Second Subtraction. This is an illegal forward pass for intentional grounding; not a valid attempt to conserve time. The penalty is loss of down at the spot of the foul. Because this occurred after the Two-Minute Timeout, this foul comes under the 10-second runoff rule. Reset the clock to 0:51 and start on the Referee's signal.",2024,5
Q-0319,Forward Pass,sideline catch;boundary;forward pass;2024-cfo-preseason-quiz;2024-cfo-preseason-quiz-v3;NCAA;UIL,Advanced,"1/10 @ A-30. Defender B21 is airborne near the sideline when he gains firm control of a legal forward pass and lands with both feet inbounds at the A-45 and is down. When B21 jumped from the sideline area, his left heel was out of bounds, and he jumped with a single process with the heel coming off the ground just before the toes.","A, 1/10, A-45, Snap.","A, 2/10, A-30, Snap.","A, 2/10, A-30, Ready.","B, 1/10, A-45, Snap.",B,,AR 7-3-6 XVI,"The correct ruling is: A, 2/10, A-30, Snap. If the toe or heel is out of bounds when a player starts a continuous heel-toe or toe-heel process of jumping, the player is out of bounds and has not re-established inbounds. Airborne B21 has not re-established inbounds and remains an out of bounds player, so the pass is incomplete.",2024,6
Q-0320,Forward Pass,intentional grounding;ineligible touch;10-second runoff;2024-cfo-preseason-quiz;2024-cfo-preseason-quiz-v3;NCAA;UIL,Advanced,"2/10 @ B-30. After the Two-Minute Timeout in the second quarter, quarterback A10, who has not been outside the tackle box, throws a desperation pass from the B-35 that falls incomplete after ineligible A58 touches the ball in an attempt to catch it at the line of scrimmage. There were no eligible receivers in the area. The clock reads 0:25 after the play.","A, 3/15, B-35, Ready.","A, 4/15, B-35, 10-Second Runoff.","A, 3/15, B-35, 10-Second Runoff.","A, 3/5, B-25, 10-Second Runoff.",C,7-3-2-g; 3-4-4,,"The correct ruling is: A, 3/15, B-35, 10-Second Runoff. A10 commits a foul for intentional grounding. There is no foul for illegal touching since the pass is illegal. The penalty is loss of down at the spot of the pass. Because this occurred after the Two-Minute Timeout, this foul comes under the 10-second runoff rule; the clock is reset to 0:15 and starts on the Referee's signal.",2024,7
Q-0321,Forward Pass,intentional grounding;end of half;2024-cfo-preseason-quiz;2024-cfo-preseason-quiz-v3;NCAA;UIL,Advanced,"2/10 @ B-30. After the Two-Minute Timeout in the second quarter, quarterback A10, who has not been outside the tackle box, throws a desperation pass from the B-35 that falls incomplete after ineligible A58 touches the ball in an attempt to catch it at the line of scrimmage. There were no eligible receivers in the area. The clock reads 0:00 after the play.","Untimed down. A, 3/15, B-35, Snap.","B, 1/10, B-35, Untimed Down.","A, 3/15, B-35, No Clock - Extend the 2nd quarter.","Half Over, at the option of Team B.",D,7-3-2-g; 3-2-3-a-1,,"The correct ruling is: Half Over, at the option of Team B. A10 commits a foul for intentional grounding. There is no foul for illegal touching since the pass is illegal. The penalty is loss of down at the spot of the pass. Because the statement of the penalty includes loss of down, the period is not extended at the option of the offended team, Team B.",2024,8
Q-0322,Instant Replay — Process,instant replay;sideline;interception;boundary;2024-cfo-preseason-quiz;2024-cfo-preseason-quiz-v3;NCAA;UIL,Advanced,1/10 @ B-40. QB A1 scrambles toward the sideline and attempts to throw the ball away out of bounds. B3 who is standing near the sideline at the B-25 jumps and controls the pass while airborne then comes down with his right foot in bounds before stepping out of bounds with his left foot while maintaining control of the ball. The Side Judge rules the pass incomplete. Replays show B3 with his right foot in bounds and his left heel touching the sideline before he steps back into the field of play with his left foot then leaves both feet to attempt to catch the ball.,"B, 1/10, B-25, Snap.","A, 1/10, B-40, Snap.","B, 1/10, B-25, Ready.","B, 1/10, B-30, Snap.",A,,,"The correct ruling is: B, 1/10, B-25, Snap. Whether B3 was in or out of bounds is reviewable. B3 is out of bounds when his left foot is touching the sideline, but re-establishes inbounds when he brings that foot off the sideline and back down in the field of play. He completes the catch, so the ruling is overturned to an interception.",2024,9
Q-0323,Instant Replay — Process,instant replay;end of half;clock review;2024-cfo-preseason-quiz;2024-cfo-preseason-quiz-v3;NCAA;UIL,Advanced,3/10 @ 50. Near the end of the first half Team A is out of timeouts. Receiver A80 catches a pass at the B-38 and runs to the B-30 and time expires. Replays show A80's right knee was down at the B-30 with 0:02 remaining on the game clock.,"A, 1/10, B-30, 0:02, Ready.",Half Over.,"A, 4/10, B-30, 0:02, Ready.","A, 1/10, B-30, No Clock - Extend the half.",B,,,"The correct ruling is: Half Over. Whether there was time remaining on the game clock when the down ended is reviewable, but since there is less than three seconds on the clock and Team A is out of timeouts by rule, the half is over. If three or more seconds remained, replay would adjust the clock and it would start on the ready for play; if Team A had a timeout, replay would adjust the clock and charge the timeout, clock on snap.",2024,10
Q-0324,Scrimmage Kicks (Punts),punt;roughing the kicker;tackle box;2024-cfo-preseason-quiz;2024-cfo-preseason-quiz-v4;NCAA;UIL,Advanced,"4/10 @ A-40. Punter A98 is 15 yards behind the neutral zone when he catches the long snap, sprints to his right and runs outside the tackle box. He then stops and punts the ball and is immediately hit by a diving B89 at the A-30. The punt rolls out of bounds at the B-25.","A, 1/10, A-30, Snap. Roughing the kicker on B89.","B, 1/10, B-25, Ready.","B, 1/10, B-25, Snap.","B, 1/10, B-30, Snap.",C,9-1-16-a-4-b,,"The correct ruling is: B, 1/10, B-25, Snap. Legal play, no foul by B89. A98 loses his roughing or running-into protection by carrying the ball outside the tackle box.",2024,1
Q-0325,Instant Replay — Targeting,targeting;punt;disqualification;2024-cfo-preseason-quiz;2024-cfo-preseason-quiz-v4;NCAA;UIL,Advanced,"4/10 @ A-40. Punter A98 is 15 yards behind the neutral zone when he catches the long snap, sprints to his right and runs outside the tackle box. He then stops and punts the ball and is immediately hit by a diving B89 at the A-30 who makes forcible contact to A98 with the crown of the helmet. The punt rolls out of bounds at the B-25.","B, 1/10, B-25, Snap.","A, 1/10, B-45, Ready. Disqualify B89.","A, 1/10, A-45, Snap. Disqualify B89.","A, 1/10, B-45, Snap. Disqualify B89.",D,9-1-16-a-4-b; 9-1-3 PENALTY; 9-1-16-a PENALTY,,"The correct ruling is: A, 1/10, B-45, Snap. Disqualify B89. A98 loses his roughing or running-into protection by carrying the ball outside the tackle box. However, even though the kicker is outside the tackle box, targeting with the crown of the helmet is a personal foul against the kicker and the penalty is enforced at the previous spot. B89 is disqualified.",2024,2
Q-0326,Scrimmage Kicks (Punts),blocked punt;holding;postscrimmage kick;2024-cfo-preseason-quiz;2024-cfo-preseason-quiz-v4;NCAA;UIL,Advanced,"4/15 @ A-30. Team A's punt is blocked behind the neutral zone and while the ball is loose, B54 holds A88 at the A-32. The ball never crosses the neutral zone during the play and B75 recovers the ball at the A-25.","A, 1/10, A-40, Snap.","A, 1/10, A-35, Snap.","B, 1/10, A-25, Snap.","A, 1/10, A-40, Ready.",A,10-2-3; 10-2-2-d-4-a; 9-3-4-d PENALTY,,"The correct ruling is: A, 1/10, A-40, Snap. Postscrimmage Kick Enforcement applies only when a scrimmage kick crosses the neutral zone. B54's holding foul is enforced from the previous spot since it occurred during the kick. Team A retains possession after the penalty is enforced at the previous spot, and the penalty statement includes an automatic first down.",2024,3
Q-0327,Scrimmage Kicks (Punts),punt return;holding;postscrimmage kick;2024-cfo-preseason-quiz;2024-cfo-preseason-quiz-v4;NCAA;UIL,Advanced,"4/15 @ A-30. A98's punt crosses the neutral zone and B44 catches the kick at the B-25 and returns to the B-40 where he is tackled. During the kick, B79 holds A55 one yard beyond the neutral zone.","B, 1/10, B-25, Snap.","B, 1/10, B-15, Snap.","A, 1/10, A-30, Snap.","B, 1/10, B-15, Ready.",B,10-2-3,,"The correct ruling is: B, 1/10, B-15, Snap. Team B keeps possession of the ball. B79's holding foul is governed by postscrimmage kick enforcement; the 10-yard penalty is enforced at the end of the kick, which is the B-25.",2024,4
Q-0328,Scrimmage Kicks (Punts),punt return;fumble;holding;postscrimmage kick;2024-cfo-preseason-quiz;2024-cfo-preseason-quiz-v4;NCAA;UIL,Advanced,"4/15 @ A-30. A98's punt crosses the neutral zone and B44 catches the kick at the B-25 and returns to the B-40 where he fumbles and A88 recovers. During the kick, B79 holds A55 one yard beyond the neutral zone.","A, 1/10, A-40, Snap.","B, 1/10, B-40, Snap.","A, 1/10, B-40, Snap.","A, 1/10, B-40, Ready.",C,10-2-3; 10-2-2-d-4-a,,"The correct ruling is: A, 1/10, B-40, Snap. B79's holding foul is not governed by postscrimmage kick enforcement since A88 recovered the fumble and Team B will not next put the ball in play. Team A will decline B79's holding penalty and take the result of the play, giving them 1st & 10 at the B-40.",2024,5
Q-0329,Personal Fouls — Contact,blind side block;interception return;2024-cfo-preseason-quiz;2024-cfo-preseason-quiz-v4;NCAA;UIL,Advanced,"1/10 @ B-40. B44 intercepts the pass of A12 at the B-20 and turns back up-field on the return. During the return, B21 approaches A88 at midfield from the blind side and blocks A88 with extended hands. B44 returns the pass to the A-20.","B, 1/10, B-35, Snap.","B, 1/10, A-20, Ready.","A, 1/10, A-20, Snap.","B, 1/10, A-20, Snap.",D,9-1-18,AR 9-1-18 I,"The correct ruling is: B, 1/10, A-20, Snap. B21 does not commit a foul for an illegal blind side block because he executes the blind side block with extended hands.",2024,6
Q-0330,Personal Fouls — Contact,blind side block;interception return;spot of foul;2024-cfo-preseason-quiz;2024-cfo-preseason-quiz-v4;NCAA;UIL,Advanced,"1/10 @ B-40. B44 intercepts the pass of A12 at the B-20 and turns back up-field on the return. During the return, B21 approaches A88 at midfield from the blind side and blocks A88 by attacking with forcible contact with his shoulder into the chest of A88. B44 returns the pass to the A-20.","B, 1/10, B-35, Snap.","B, 1/10, A-20, Snap.","A, 1/10, B-35, Snap.","B, 1/10, B-35, Ready.",A,9-1-18; 10-2-2-c-1,AR 9-1-18 I,"The correct ruling is: B, 1/10, B-35, Snap. B21 is guilty of an illegal blind side block, approaching A88 at midfield from the blind side and blocking with forcible contact. The foul occurred after the change of possession, so Team B keeps the ball and the 15-yard penalty is enforced from the spot of the foul, midfield.",2024,7
Q-0331,Instant Replay — Targeting,targeting;blind side block;disqualification;defenseless player;2024-cfo-preseason-quiz;2024-cfo-preseason-quiz-v4;NCAA;UIL,Advanced,"1/10 @ B-40. B44 intercepts the pass of A12 at the B-20 and turns back up-field on the return. During the return, B21 approaches A88 at midfield from the blind side and blocks A88 by attacking with forcible contact with the shoulder into the head of A88. B44 returns the pass to the A-20.","B, 1/10, B-35, Snap.","B, 1/10, B-35, Snap. Disqualify B21.","B, 1/10, A-20, Snap. Disqualify B21.","A, 1/10, B-35, Snap. Disqualify B21.",B,9-1-4; 9-1-18; 2-27-14-g; 10-2-2-c-1,AR 9-1-18 I,"The correct ruling is: B, 1/10, B-35, Snap. Disqualify B21. B21 is guilty of an illegal blind side block with Targeting, attacking A88's head and neck area from the blind side. A88 is a defenseless player because he receives a blind side block. The foul occurred after the change of possession, so Team B keeps the ball and the 15-yard penalty is enforced from the spot of the foul, midfield. B21 is disqualified.",2024,8
Q-0332,Instant Replay — Process,instant replay;catch process;goal line;two-minute timeout;2024-cfo-preseason-quiz;2024-cfo-preseason-quiz-v4;NCAA;UIL,Advanced,"3/10 @ B-30. Late in the 2nd quarter, receiver A80 controls A1's deep pass at the B-2 and goes to the ground in the end zone. The Side Judge rules TD (0:23). Replays show after gaining control A80's left knee hit the ground and the ball was at the B-1 (0:25) before he completed the catch in the end zone.","Touchdown stands. A, Try, B-1, No Clock.","A, 1/Goal, B-1, 0:23, Ready.","A, 1/Goal, B-1, reset clock to 0:25, Ready.","A, 1/Goal, B-2, reset clock to 0:25, Ready.",C,,,"The correct ruling is: A, 1/Goal, B-1, reset clock to 0:25, Ready. Whether A80 caught the pass and the ball in relation to the goal line are reviewable aspects of the play. A80 completes the process of the catch but is down by rule when his knee touches the ground after control is established. The clock is reset since it is after the two-minute timeout and the line to gain was made; there is no runoff since the clock stops when the line to gain is reached.",2024,9
Q-0333,Instant Replay — Process,instant replay;down by contact;fumble;10-second runoff;2024-cfo-preseason-quiz;2024-cfo-preseason-quiz-v4;NCAA;UIL,Advanced,"2/5 @ B-35. On the first play after the two-minute timeout, QB A1 is tackled at the B-40 and the ball comes loose (1:55). B56 recovers and runs to the A-40 where he is tackled in bounds (1:48). The officials rule fumble. Replays show A1's right knee down before the ball came loose.","B, 1/10, A-40, reset clock to 1:48, Snap.","A, 3/10, B-40, reset clock to 1:55, Ready.","A, 2/10, B-40, reset clock to 1:55 and 10-second runoff rule applies.","A, 3/10, B-40, reset clock to 1:55 and 10-second runoff rule applies.",D,,,"The correct ruling is: A, 3/10, B-40, reset clock to 1:55 and 10-second runoff rule applies. Whether A1 was down or not is reviewable. Since this play takes place after the two-minute timeout and A1 was down short of the line to gain, the clock would have continued to run, so the runoff rule applies. Either team can take a remaining timeout to avoid the runoff; if the runoff applies, the clock resets to 1:45 and starts on ready, and if a timeout is taken, the clock stays at 1:55 and starts on snap.",2024,10
Q-0334,Free Kicks,green dot;coach-to-player communication;free kick;2024-cfo-preseason-quiz;2024-cfo-preseason-quiz-v5;NCAA;UIL,Intermediate,Free Kick @ A-35. A98's free kick is caught at the goal line and B44 returns the kick to the B-25. Team A had 3 green dot helmets on the kickoff indicating that 3 Team A players on the field had receiving capability for coach-to-player communications.,"B, 1/10, B-25, Snap.","A, 1/10, A-35, Snap. 5-yard equipment penalty on Team A.","B, 1/10, B-25, Ready.","B, 1/10, B-20, Snap.",A,1-4-11-b Exception,,"The correct ruling is: B, 1/10, B-25, Snap. On free kick plays, the coach-to-player communications limit is not in effect. There is no limitation to the number of green dot helmets for either team during free kick plays.",2024,1
Q-0335,"Game, Field & Equipment",green dot;coach-to-player communication;equipment;2024-cfo-preseason-quiz;2024-cfo-preseason-quiz-v5;NCAA;UIL,Advanced,4/2 @ B-40. Team A QB A12 is in shotgun formation and the backup QB A10 is positioned as a wideout. A12 hands the ball to A44 and he gains 4 yards on the play. Both A12 and A10 have green dot helmets indicating that they have receiving capability for coach-to-player communications.,"A, 4/2, B-40, Ready.","A, 4/7, B-45, Ready.","A, 4/7, B-45, Snap.","B, 1/10, A-45, Ready.",B,1-4-11-b Exception,,"The correct ruling is: A, 4/7, B-45, Ready. If more than one green dot helmet per team is detected on the field, the result is a live ball 5-yard equipment violation penalty, enforced from the previous spot. This penalty also initiates a conference review.",2024,2
Q-0336,Forward Pass,ineligible receiver downfield;neutral zone;forward pass;2024-cfo-preseason-quiz;2024-cfo-preseason-quiz-v5;NCAA;UIL,Advanced,"3/10 @ A-25. A12 throws a legal forward pass, and receiver A88 first touches the pass when the ball is 1 1/2 yards beyond the neutral zone. The receiver's back foot is not beyond the neutral zone. A88 runs to the A-35 after the catch, and A77 was at the A-29 when A88 first touched the pass.","A, 1/10, A-35, Ready.","A, 3/15, A-20, Snap.","A, 3/15, A-20, Ready.","A, 3/5, A-30, Ready.",C,2-19-3-a; 2-19-3-b; 7-3-10,,"The correct ruling is: A, 3/15, A-20, Ready. The guiding principle on a pass crossing the neutral zone is the location of the ball when it is first touched, not the player's position. Since the pass crossed the neutral zone before A88 touched it, A77 has committed a foul for ineligible receiver downfield.",2024,3
Q-0337,Backward Pass & Fumbles,snap;backward pass;fourth down;touchdown;2024-cfo-preseason-quiz;2024-cfo-preseason-quiz-v5;NCAA;UIL,Advanced,4/Goal @ B-5. A55's legal snap is muffed by A12 and A21 recovers at the B-7 and advances the ball into the end zone.,"Illegal advance - no score. A, Try, B-3, No Clock.","Touchdown. A, Try, B-3, Running Clock.","Touchdown. A, Try, B-5, No Clock.","Touchdown. A, Try, B-3, No Clock.",D,7-2-2-a,,"The correct ruling is: Touchdown. A, Try, B-3, No Clock. The snap is a backward pass and not a fumble. There is no restriction on a Team A player recovering and advancing a backward pass on 4th down. The recovery and advance by A21 is legal.",2024,4
Q-0338,Penalty Enforcement — Spot & Distance,roughing the passer;half the distance;fumble recovery;2024-cfo-preseason-quiz;2024-cfo-preseason-quiz-v5;NCAA;UIL,Advanced,"3/10 @ B-40. A81 catches A12's forward pass at the B-35 and fumbles at the B-31. The fumble is recovered by grounded A84 five yards in advance of the fumble. Just after releasing the pass, A12 was roughed by B54.","A, 1/10, B-13, Ready.","A, 1/10, B-31, Ready.","A, 1/10, B-13, Snap.","A, 2/5, B-26, Ready.",A,9-1 Penalty; 10-2-6,,"The correct ruling is: A, 1/10, B-13, Ready. The penalty for B54's roughing the passer foul is enforced from the B-26, the spot of recovery by A84 and the end of last run for Team A. The penalty is half the distance to the goal line and includes an automatic 1st down.",2024,5
Q-0339,Series of Downs & Line to Gain,extra period;blocked field goal;overtime;2024-cfo-preseason-quiz;2024-cfo-preseason-quiz-v5;NCAA;UIL,Advanced,"3/Goal @ B-6. During the second possession series of the first extra period with the score tied, Team A decides to attempt a field goal on 3rd down. The field goal attempt is blocked, and the ball does not cross the neutral zone. A23 recovers the ball at the B-10, runs and is tackled at the B-3.","B, 1/10, B-3, No clock.","A, 4/Goal, B-3, No clock.","A, 1/Goal, B-3, No clock.","A, 4/Goal, B-6, No clock.",B,6-3-1-a; 3-1-3-e,AR 3-1-3 V,"The correct ruling is: A, 4/Goal, B-3, No clock. Each team retains the ball during a possession series in extra periods until it scores or fails to make a first down. Because the kick never crossed the neutral zone, A23's recovery and advance is legal. Since it was 3rd down and Team A advanced but did not make a first down, it is Team A's ball on 4th down.",2024,6
